{
  "schema_version": "0.1",
  "archive_version": "0.1",
  "last_modified_at": "2026-06-05T09:51:42+09:00",
  "timezone": "Asia/Seoul",
  "notice_count": 93,
  "event_count": 93,
  "latest_event_id": "2026-06-05T09:51:42+09:00|added|pnu-main-notice:1509293|af3bcc069a2f",
  "months": [
    {
      "month": "2025-08",
      "notices_url": "./notices/2025-08.json",
      "events_url": null,
      "notice_count": 1,
      "event_count": 0,
      "notices_size_bytes": 3928,
      "events_size_bytes": 0,
      "notices_sha256": "ade7c4d0f3c245c75127fcd2122535915e3d87b40d580851e2c4a869523ae3ca",
      "events_sha256": null,
      "last_modified_at": "2026-06-04T22:23:14+09:00",
      "first_seen_at": "2026-06-04T22:23:14+09:00",
      "last_seen_at": "2026-06-04T22:23:14+09:00"
    },
    {
      "month": "2025-09",
      "notices_url": "./notices/2025-09.json",
      "events_url": null,
      "notice_count": 1,
      "event_count": 0,
      "notices_size_bytes": 6472,
      "events_size_bytes": 0,
      "notices_sha256": "b54503d3df7987003bad37625a8c9b85f8499dedeeb15606ad1fd9f009e69a8b",
      "events_sha256": null,
      "last_modified_at": "2026-06-04T22:23:14+09:00",
      "first_seen_at": "2026-06-04T22:23:14+09:00",
      "last_seen_at": "2026-06-04T22:23:14+09:00"
    },
    {
      "month": "2025-10",
      "notices_url": "./notices/2025-10.json",
      "events_url": null,
      "notice_count": 2,
      "event_count": 0,
      "notices_size_bytes": 11633,
      "events_size_bytes": 0,
      "notices_sha256": "90eb3f12b63fd310c856c80ed97ea1587e9236a262eb3f0b6e150e47cba33fc0",
      "events_sha256": null,
      "last_modified_at": "2026-06-04T22:23:14+09:00",
      "first_seen_at": "2026-06-04T22:23:14+09:00",
      "last_seen_at": "2026-06-04T22:23:14+09:00"
    },
    {
      "month": "2025-11",
      "notices_url": "./notices/2025-11.json",
      "events_url": null,
      "notice_count": 3,
      "event_count": 0,
      "notices_size_bytes": 14843,
      "events_size_bytes": 0,
      "notices_sha256": "a095d87de38247fd3e93c9b6e6ebd77da6515bf7b0bd1a7145f187918c718f73",
      "events_sha256": null,
      "last_modified_at": "2026-06-04T22:23:14+09:00",
      "first_seen_at": "2026-06-04T22:23:14+09:00",
      "last_seen_at": "2026-06-04T22:23:14+09:00"
    },
    {
      "month": "2025-12",
      "notices_url": "./notices/2025-12.json",
      "events_url": null,
      "notice_count": 1,
      "event_count": 0,
      "notices_size_bytes": 4476,
      "events_size_bytes": 0,
      "notices_sha256": "bbfdb2f61486d71ae77b4dcd015a4bcca4defe72ca710bdb57268e8d8fa393fc",
      "events_sha256": null,
      "last_modified_at": "2026-06-04T22:23:14+09:00",
      "first_seen_at": "2026-06-04T22:23:14+09:00",
      "last_seen_at": "2026-06-04T22:23:14+09:00"
    },
    {
      "month": "2026-01",
      "notices_url": "./notices/2026-01.json",
      "events_url": null,
      "notice_count": 4,
      "event_count": 0,
      "notices_size_bytes": 18044,
      "events_size_bytes": 0,
      "notices_sha256": "9c964052689091d3282f8d92365a6773726ebb7fd78f30079df7c1c53b45560c",
      "events_sha256": null,
      "last_modified_at": "2026-06-04T22:23:14+09:00",
      "first_seen_at": "2026-06-04T22:23:14+09:00",
      "last_seen_at": "2026-06-04T22:23:14+09:00"
    },
    {
      "month": "2026-02",
      "notices_url": "./notices/2026-02.json",
      "events_url": null,
      "notice_count": 7,
      "event_count": 0,
      "notices_size_bytes": 31126,
      "events_size_bytes": 0,
      "notices_sha256": "84f48879c55fc26b67631756a0936c4690255b80f4eb7e202ef96e3fa6993e88",
      "events_sha256": null,
      "last_modified_at": "2026-06-04T22:23:14+09:00",
      "first_seen_at": "2026-06-04T22:23:14+09:00",
      "last_seen_at": "2026-06-04T22:23:14+09:00"
    },
    {
      "month": "2026-03",
      "notices_url": "./notices/2026-03.json",
      "events_url": null,
      "notice_count": 5,
      "event_count": 0,
      "notices_size_bytes": 27583,
      "events_size_bytes": 0,
      "notices_sha256": "518043302186daba10f1e4ad82f579188e01ec88785f2f01aa55368a7c1e575b",
      "events_sha256": null,
      "last_modified_at": "2026-06-04T22:23:14+09:00",
      "first_seen_at": "2026-06-04T22:23:14+09:00",
      "last_seen_at": "2026-06-04T22:23:14+09:00"
    },
    {
      "month": "2026-04",
      "notices_url": "./notices/2026-04.json",
      "events_url": null,
      "notice_count": 24,
      "event_count": 0,
      "notices_size_bytes": 98400,
      "events_size_bytes": 0,
      "notices_sha256": "8c4d556458b0d36952ee0600473345bf9a85ae75b5748ce585ef550e8ef514cb",
      "events_sha256": null,
      "last_modified_at": "2026-06-05T01:02:29+09:00",
      "first_seen_at": "2026-06-04T22:23:14+09:00",
      "last_seen_at": "2026-06-05T01:02:29+09:00"
    },
    {
      "month": "2026-05",
      "notices_url": "./notices/2026-05.json",
      "events_url": null,
      "notice_count": 22,
      "event_count": 0,
      "notices_size_bytes": 92451,
      "events_size_bytes": 0,
      "notices_sha256": "059dc0919f9a5dd3afb192764df0fa47c699932d2df308d12e8d9fc43e513821",
      "events_sha256": null,
      "last_modified_at": "2026-06-04T22:23:14+09:00",
      "first_seen_at": "2026-06-04T20:09:36+09:00",
      "last_seen_at": "2026-06-04T22:23:14+09:00"
    },
    {
      "month": "2026-06",
      "notices_url": "./notices/2026-06.json",
      "events_url": "./events/2026-06.json",
      "notice_count": 23,
      "event_count": 93,
      "notices_size_bytes": 93519,
      "events_size_bytes": 69374,
      "notices_sha256": "00eae26252a6d8927f8e19b777120785b15857db51c7767f4c666ea5ad8568c7",
      "events_sha256": "1982bff0325ece7febd6abaa21c1407e4108905caf3c4951a4be37aeefa65122",
      "last_modified_at": "2026-06-05T09:51:42+09:00",
      "first_seen_at": "2026-06-04T20:09:36+09:00",
      "last_seen_at": "2026-06-05T09:51:42+09:00"
    }
  ],
  "sources": [
    {
      "id": "pnu-main-notice",
      "notice_count": 22,
      "event_count": 22,
      "first_seen_at": "2026-06-04T20:09:36+09:00",
      "last_seen_at": "2026-06-05T09:51:42+09:00"
    },
    {
      "id": "pnu-onestop-notices",
      "notice_count": 36,
      "event_count": 36,
      "first_seen_at": "2026-06-04T22:23:14+09:00",
      "last_seen_at": "2026-06-05T01:02:29+09:00"
    },
    {
      "id": "pnu-onestop-scholarship",
      "notice_count": 35,
      "event_count": 35,
      "first_seen_at": "2026-06-04T22:23:14+09:00",
      "last_seen_at": "2026-06-04T22:23:14+09:00"
    }
  ]
}
